{
  "$schema": "http://json-schema.org/draft-07/schema#",
  "title": "MCGuard Configuration",
  "description": "Configuration schema for MCGuard standalone Minecraft security auditor",
  "type": "object",
  "properties": {
    "$schema": {
      "type": "string"
    },
    "version": {
      "type": "string"
    },
    "network": {
      "type": "object",
      "properties": {
        "default_policy": {
          "type": "string",
          "enum": ["BLOCK", "ALLOW"]
        },
        "allow_localhost": {
          "type": "boolean"
        },
        "allow_lan": {
          "type": "boolean",
          "description": "Allow RFC 1918 private LAN traffic (10.0.0.0/8, 172.16.0.0/12, 192.168.0.0/16)"
        },
        "allow_dns": {
          "type": "boolean"
        },
        "allowed_domain_suffixes": {
          "type": "array",
          "items": {
            "type": "string"
          }
        },
        "whitelist": {
          "type": "array",
          "items": {
            "type": "object",
            "properties": {
              "description": {
                "type": "string"
              },
              "host": {
                "type": "string"
              },
              "ip": {
                "type": "string"
              },
              "port": {
                "type": "integer"
              },
              "protocol": {
                "type": "string",
                "enum": ["TCP", "UDP", "ANY"]
              }
            },
            "required": ["port"]
          }
        }
      },
      "required": ["default_policy", "whitelist"]
    },
    "file_audit": {
      "type": "object",
      "properties": {
        "enabled": {
          "type": "boolean"
        },
        "highlight_sensitive": {
          "type": "boolean"
        },
        "auto_whitelist_game_dir": {
          "type": "boolean",
          "description": "Automatically detect and whitelist Minecraft game directory from Process Start"
        },
        "allowed_folders": {
          "type": "array",
          "items": {
            "type": "string"
          },
          "description": "Explicit list of allowed folders for Minecraft I/O"
        },
        "sensitive_patterns": {
          "type": "array",
          "items": {
            "type": "string"
          }
        }
      }
    },
    "logging": {
      "type": "object",
      "properties": {
        "jsonl_output": {
          "type": "string"
        },
        "console_output": {
          "type": "boolean"
        },
        "verbose": {
          "type": "boolean"
        },
        "auto_close_on_exit": {
          "type": "boolean",
          "description": "Automatically close the monitor console window after Minecraft process terminates (defaults to false)"
        },
        "auto_close_delay": {
          "type": "integer",
          "description": "Delay in seconds before closing the console when auto_close_on_exit is enabled (default: 5)"
        }
      }
    },
    "sandbox": {
      "type": "object",
      "properties": {
        "enabled": { "type": "boolean", "description": "Enable sandbox launcher execution" },
        "block_child_processes": { "type": "boolean", "description": "Prevent child process breakout (cmd.exe, powershell)" },
        "use_job_object": { "type": "boolean", "description": "Enforce ActiveProcessLimit = 1 via Windows Job Object" },
        "real_java_path": { "type": "string", "description": "Path to target java.exe/javaw.exe executable (optional)" }
      }
    },
    "appcontainer": {
      "type": "object",
      "description": "Windows AppContainer Sandbox Isolation and HKCU Registry Protection Settings",
      "properties": {
        "enabled": { "type": "boolean", "description": "Enable Windows AppContainer Isolation for Minecraft/JVM" },
        "profile_name": { "type": "string", "description": "AppContainer profile name (e.g. MCGuard.Sandbox)" },
        "allowed_hkcu_keys": {
          "type": "array",
          "items": { "type": "string" },
          "description": "Explicit list of HKCU subkeys granted read-only access for AppContainer SID (Tier B). HKCU root and Software root are never exposed."
        },
        "enable_broker": { "type": "boolean", "description": "Enable Named Pipe IPC Broker for mediated sensitive queries (Tier C)" },
        "broker_allowed_keys": {
          "type": "array",
          "items": { "type": "string" },
          "description": "Whitelisted registry/environment keys the Broker will return to the sandbox."
        }
      }
    }
  },
  "required": ["network"]
}
